{
  "annotations": [
    {
      "chapter_id": 1,
      "payload": {
        "close_char": "”",
        "open_char": "“"
      },
      "record_id": "784bc9b4428e011ca1c08630f4967a6a378fdf3355a6d8966d09585d4dbc8ecf",
      "source": "regex",
      "tag": "quote",
      "text": "“Wake,”",
      "token_span": [
        0,
        4
      ]
    },
    {
      "chapter_id": 1,
      "payload": {
        "close_char": null,
        "open_char": null
      },
      "record_id": "d4b69861e4ff93e050c083919f13c06bfffeedf645d57e101ec765eca9472064",
      "source": "regex",
      "tag": "em_dash_dialogue",
      "text": "— We shouldn’t be here.",
      "token_span": [
        8,
        16
      ]
    },
    {
      "chapter_id": 1,
      "payload": {
        "close_char": "”",
        "open_char": "“"
      },
      "record_id": "3f7e702a161bbf4c23b27bba790045a652cc52d2e76530d9b571c29f938eee2d",
      "source": "regex",
      "tag": "quote",
      "text": "“No,”",
      "token_span": [
        16,
        20
      ]
    },
    {
      "chapter_id": 1,
      "payload": {
        "close_char": "”",
        "open_char": "“"
      },
      "record_id": "a7ef73384620cc3514275f63fd472530aa36e3235ec5549a8a3e50a5c9f1743a",
      "source": "regex",
      "tag": "quote",
      "text": "“But listen...\nwe can still turn back.”",
      "token_span": [
        23,
        36
      ]
    },
    {
      "chapter_id": 2,
      "payload": {
        "close_char": "”",
        "open_char": "“"
      },
      "record_id": "cd25d275f2ee726a9b6a8b37944ffd7b2ba7f63797ee4b5df4098e17aca498f3",
      "source": "regex",
      "tag": "quote",
      "text": "“Hello.”",
      "token_span": [
        4,
        8
      ]
    }
  ],
  "layer": "quotes",
  "normalization_version": "nfc-crlf2lf-v1",
  "pipeline_version": "0.1.0",
  "text_hash": {
    "full_corpus": "5b2242fff678ce7d00a7937da2aa0b4d6e4ae1fdac3e9dbf89ad0644c120dc75",
    "per_chapter": {
      "1": "8cb9c4fa162bac045745ae5b48421b81e96021d5c1ac94a11516eac63c596e09",
      "2": "b0dc061fbb0ddcfc1d742e97de549fac3a95f44bf2e062207255a38acbae80af"
    }
  },
  "tokenization": {
    "algo": "tok-v1",
    "per_chapter": {
      "1": {
        "count": 36,
        "sha": "76982434572d7245f051aa7c90af4eb7a13b75fb8ac208b10dd355a3f93343c5"
      },
      "2": {
        "count": 16,
        "sha": "b635ceaf54e63c0c4ef70e4563380783e8429eeb8df41b109ce3c51c1d2750f0"
      }
    },
    "version": "tok-v1"
  },
  "work_slug": "sample"
}
